{
  "$schema": "http://json-schema.org/draft-07/schema#",
  "title": "CanonicalDocument",
  "description": "A normalized, source-traceable document produced by the ingestion pipeline. Represents one stable logical unit that can later be re-chunked.",
  "type": "object",
  "required": [
    "document_id",
    "source_ref",
    "locator",
    "content"
  ],
  "additionalProperties": false,
  "properties": {
    "document_id": {
      "type": "string",
      "description": "Stable identifier for this canonical document"
    },
    "source_ref": {
      "$ref": "./common.schema.json#/$defs/sourceRef"
    },
    "locator": {
      "$ref": "./common.schema.json#/$defs/locator"
    },
    "content": {
      "type": "string",
      "description": "Normalized text content of the canonical document"
    },
    "document_title": {
      "type": "string",
      "description": "Optional local title for this canonical document or entry"
    },
    "source_checksum": {
      "type": "string",
      "description": "Optional checksum of the raw source artifact used during ingestion"
    },
    "source_version": {
      "type": "string",
      "description": "Optional version or printing identifier for the source"
    },
    "ingested_at": {
      "type": "string",
      "format": "date-time",
      "description": "ISO 8601 timestamp of when this document was produced"
    },
    "processing_hints": {
      "type": "object",
      "additionalProperties": false,
      "description": "Optional pipeline-internal handoffs from ingestion to chunker. Not citation/provenance metadata.",
      "properties": {
        "chunk_type_hint": {
          "type": "string",
          "enum": ["spell_entry", "feat_entry", "skill_entry", "condition_entry", "class_feature", "glossary_entry"],
          "description": "Pre-computed chunk_type for the parent chunk; chunker uses this in lieu of heuristic classification"
        },
        "structure_cuts": {
          "type": "array",
          "description": "Ordered list of structural splits in content. Chunker slices content at these char offsets to produce typed children.",
          "items": {
            "type": "object",
            "required": ["kind", "char_offset", "child_chunk_type"],
            "additionalProperties": false,
            "properties": {
              "kind": {"enum": ["stat_block_end"]},
              "char_offset": {"type": "integer", "minimum": 0},
              "child_chunk_type": {"enum": ["stat_block"]}
            }
          }
        }
      }
    }
  }
}
