{
  "document_id": "srd_35_fixture::specialmaterials::003_special_weapons_materials",
  "source_ref": {
    "source_id": "srd_35_fixture",
    "title": "SRD 3.5 Fixture Corpus (Real Source Files)",
    "edition": "3.5e",
    "source_type": "srd",
    "authority_level": "official_reference"
  },
  "locator": {
    "section_path": [
      "SpecialMaterials",
      "SPECIAL WEAPONS MATERIALS"
    ],
    "source_location": "SpecialMaterials.rtf#003_special_weapons_materials"
  },
  "content": "Each of the special materials described below has a definite game effect. Some c\nreatures have damage reduction based on their creature type or core concept. Some are resistant to all but a special type of damage, such as that dealt by evil-aligned weapons or bludgeoning weapons. Others are vulnerable to weapons of a particular materi\nal. Characters may choose to carry several different types of weapons, depending upon the campaign and types of creatures they most commonly encounter.\nAdamantine: This ultrahard metal adds to the quality of a weapon or suit of armor. Weapons fashioned fr\nom adamantine have a natural ability to bypass hardness when sundering weapons or attacking objects, ignoring hardness less than 20. Armor made from adamantine grants its wearer damage reduction of 1/- if it's light armor, 2/- if it\n's medium armor, and 3/- if it'\ns heavy armor. Adamantine is so costly that weapons and armor made from it are always of masterwork quality; the masterwork cost is included in the prices given below. Thus, adamantine weapons and ammunition have a +1 enhancement bonus on attack rol\nls, and the armor check penalty of adamantine armor is lessened by 1 compared to ordinary armor of its type. Items without metal parts cannot be made from adamantine. An arrow could be made of adamantine, but a quarterstaff could not.\nOnly weapons, armor,\nand shields normally made of metal can be fashioned from adamantine. Weapons, armor and shields normally made of steel that are made of adamantine have one-third more hit points than normal. Adamantine has 40 hit points per inch of thickness and hardness\n20.\nType of Adamantine Item |\nItem Cost Modifier |\n\n+60 gp |\nLight armor | +5,000 gp |\nMedium armor |\n+10,000 gp |\nHeavy armor | +15,000 gp |\nWeapon | +3,000 gp |\nDarkwood: This rare magic wood is as hard as normal wood but ver\ny light. Any wooden or mostly wooden item (such as a bow, an arrow, or a spear) made from darkwood is considered a masterwork item and weighs only half as much as a normal wooden item of that type. Items not normally made of wood or only partially of wood\n(such as a battleaxe or a mace) either cannot be made from darkwood or do not gain any special benefit from being made of darkwood. The armor check penalty of a darkwood shield is lessened by 2 compared to an ordinary shield of its type. To determine the\nprice of a darkwood item, use the original weight but add 10 gp per pound to the price of a masterwork version of that item.\nDarkwood has 10 hit points per inch of thickness and hardness 5.\nDragonhide: Armorsmiths can work with the hides of dragons to prod\nuce armor or shields of masterwork quality. One dragon produces enough hide for a single suit of masterwork hide armor for a creature one size category smaller than the dragon. By selecting only choice scales and bits of hide, an armorsmith can produce on\ne\nsuit of masterwork banded mail for a creature two sizes smaller, one suit of masterwork half-plate for a creature three sizes smaller, or one masterwork breastplate or suit of full plate for a creature four sizes smaller. In each case, enough hide is ava\nilable to produce a small or large masterwork shield in addition to the armor, provided that the dragon is Large or larger.\nBecause dragonhide armor isn't made of metal, druids can wear it without penalty.\nDragonhide armor costs double what masterwork armor of that type ordinarily costs, but it takes no longer to make than ordinary armor of that type.\nDragonhide has 10 hit points per inch of thickness and hardness 10.\nIron, Cold: This iron, mined deep underground, known for its effectiveness against fey cre\natures, is forged at a lower temperature to preserve its delicate properties. Weapons made of cold iron cost twice as much to make as their normal counterparts. Also, any magical enhancements cost an additional 2,000 gp.\nItems without metal parts cannot be made from cold iron. An arrow could be made of cold iron, but a quarterstaff could not.\nA double weapon that has only half of it made of cold iron increases its cost by 50%.\nCold iron has 30 hit points per inch of thickness and hardness 10.",
  "document_title": "SPECIAL WEAPONS MATERIALS",
  "source_checksum": "f25faa8965a41754187cc472f4934daa7739ce83"
}
